{
  "type": "ShakeLabTaxonomyTree",
  "schema_version": "1.0.0",
  "metadata": {
    "name": "Three taxonomy mapping",
    "date": "2026-08-24",
    "description": "RC low-rise and mid-rise deterministic mappings; URM low-rise epistemic mixture."
  },
  "mappings": {
    "RC-LRS": {
      "fragility_models": [
        {
          "id": "GENERIC_RC_LR_PGA_LN_V1"
        }
      ]
    },
    "RC-MID": {
      "fragility_models": [
        {
          "id": "GENERIC_RC_MID_PGA_LN_V1"
        }
      ]
    },
    "MUR-URM-LOW": {
      "fragility_models": [
        {
          "id": "GENERIC_URM_LR_PGA_LN_V1",
          "weight": 0.7
        },
        {
          "id": "GENERIC_URM_LR_PGA_LN_V2",
          "weight": 0.3
        }
      ]
    }
  }
}
